_id,评论内容,喜欢的菜,发布时间,用户总分,用户打分
{'$oid': '665dad89206d76c065d5ba0e'},昨天get的超好吃的虎皮盒子绝美味搭配，今天刚好在附近，就为了这口，下着雨抱着娃打着伞真的不容易啊，哈哈哈。（双层虎皮+黑芝麻奶酪+抹茶奶油+奥利奥+海苔肉松） 还买了店员推荐的肉松蛋糕，芋泥奶酪球，肉松奶酪球。好期待啊～ 下次再去吃就问问订制欧包怎么买 店面比街道口的那家小，种类好像也不少，店员说话很快，是个急性子，不过业务很熟悉，估计平时不下雨的时候人流量不少，被锻炼出来了。哈哈哈。 本次消费40+，虎皮盒子20+，奶酪球11+，肉松蛋糕9+～买完单意外多了一个小面包，哈哈哈，偏甜。,"['定制虎皮盒子', '香葱肉松蛋糕卷']","2024-05-30
  更新于2024-05-31 19:58",4.0,"{'口味': '4.0', '环境': '4.0', '服务': '3.5', '性价比': '4.0'}"
{'$oid': '665dad89206d76c065d5ba0e'},让我想再去一次武汉的冲动！ 佳哥你真的不能来杭州么！！！ 冒着大雨在江汉路排了1h 定制了一个「定制虎皮盒子」 抹茶奶油+芋泥+麻薯+奥利奥单层虎皮 抹茶奶油太美味了！！！  「抹茶奶冻虎皮卷」这个也很好吃！ 但是茉莉抹茶那款就一般般！  「芋泥芝士丸子」里面的奶酪很绵密很扎实  「香葱火腿卷」这个有点一般般  「抹茶奶油麻薯球」三个口味的麻薯球都买了咖啡的最好吃！！！  还瞄到了边角料问了收银员5r就拿下来！ 好幸福的武汉人民啊,"['定制虎皮盒子', '虎皮卷', '抹茶奶冻虎皮卷']",2024-05-28 13:11,5.0,"{'口味': '5.0', '环境': '5.0', '服务': '5.0', '性价比': '5.0'}"
{'$oid': '665dad89206d76c065d5ba0e'},我们周六下午五点左右到达江汉路步行街那边的店，正好那个点不要排队 现场搜小红书随便选了一款定制盒子 麻薯，紫米，流沙，肉松，抹茶奶油＋一层虎皮 还随便点了两个麻薯球，黑芝麻流沙＋抹茶奶油奥利奥 我们第二天早上才吃，还是爆炸好吃，甜度刚刚好一点不会腻，是食物本身的味道 如果我再去武汉一定是因为想吃这个了,['定制虎皮盒子'],2024-05-27 21:48,5.0,"{'口味': '5.0', '环境': '5.0', '服务': '5.0', '性价比': '5.0'}"
{'$oid': '665dad89206d76c065d5ba0e'},武汉甜品打卡——纯坊佳哥手作 「芋泥麻薯球」 芋泥好清淡有点一般 「黑芝麻流沙麻薯球」 这个是这次吃到的全场最佳黑芝麻醇厚蛋黄流沙也很香 「抹茶奶油麻薯球」「酸奶爆浆麻薯球」「咖啡爆浆麻薯」 买了三种口味的奶油麻薯酸奶咖啡抹茶都一般比较腻口奶油应该是植物奶油酸奶算是全场最佳了 「咸蛋黄肉松饼」 这个也还可以朋友觉得会比较干噎,[],2024-06-01 17:04,3.0,"{'口味': '3.0', '环境': '3.0', '服务': '3.0', '性价比': '3.0'}"
{'$oid': '665dad89206d76c065d5ba0e'},每天都排队⁉️老人家也来凑凑年轻人的热闹  [薄荷]环境： 佳哥在江汉路有家店，但凡路过都排队。。。好奇害死猫🐱于是在一个要下雨的时间来排队，前后差不多一个小时⏰  口味：原料： 「抹茶奶冻卷」抹茶味正，会有点微苦，介意的别买，喜欢的无脑冲，奶冻Q弹软滑。 「定制虎皮盒子」特色必买款，于是也点了，加了芋泥、紫米、流沙，分量足，味道按个人喜好自己选择，店员添加到里面。 「麻薯布丁」馅料足，个头大，不会甜腻🏻 「咖啡爆浆麻薯」这个我最喜欢，后悔买少了,"['定制虎皮盒子', '咖啡爆浆麻薯']",2024-05-07 22:17,4.5,"{'口味': '4.5', '环境': '4.5', '服务': '4.5', '性价比': '4.5'}"
{'$oid': '665dad89206d76c065d5ba0e'},[薄荷]环境: 位置在江汉路步行街中国黄金的旁边，店铺还挺大的，很好找。 只能打包不能堂食。 点盒子的时候店员会拿一个小卡片记录，由后厨现场做完到收银处取餐，产品几乎都是称重计价。整个流程非常流畅，店员动作也很麻利。 「定制虎皮盒子」海苔肉松黑芝麻核桃紫米流沙定制虎皮盒子21.96元。 这个搭配虽然有点干噎，但是真的很好吃。特别是里面的黑芝麻非常醇香。上面的海苔肉松也是很脆，冷藏一天也不会软掉，可以媲美鲍师傅了。就是紫米有点多余可以换芋泥或者麻薯应该更好吃。 「芋泥奶酪球」6.16元。 芋泥是纯芋泥，非常细腻而且没有加糖。中间的奶酪也是纯纯的安佳奶酪没有任何调味，酸咸口。也属于比较噎的，吃不习惯的朋友可以点别的口味。 他们家的原料大部分没怎么加工，相对比较健康。,['定制虎皮盒子'],2024-04-21 12:37,4.5,"{'口味': '4.5', '环境': '5.0', '服务': '5.0', '性价比': '5.0'}"
{'$oid': '665dad89206d76c065d5ba0e'},家人们！终于知道为什么去武汉一定要买佳哥！便宜又好吃，这排队谁不愿意啊！ [樱花]性价比： 买了四盒才不到40元，谁懂啊！这个价格也太香了！后悔没多买几盒！佳哥的奶油都好好吃，是那种很奶油的丝滑，一吃就是好的奶油！口感非常细腻而且不甜！每个味道都刚刚好[点赞][点赞]太厉害了 「抹茶奶冻虎皮卷」喜欢抹茶的朋友一定无脑冲！这款抹茶保留本身的苦味，虎皮卷是微甜的刚刚好综合一起，不喜欢甜的朋友买这款没错 「斑斓椰子蛋糕」这款最爱！上面一层的椰子碎加上清新的斑斓蛋糕，一个人吃一盒都不够，特别香甜软糯，入口即化的感觉 「香葱火腿卷」这个适合重口的朋友，肉松比较咸一点！ 「抹茶奶油麻薯球」同款喜欢抹茶的朋友可以无脑冲了！,[],2024-05-07 22:59,5.0,"{'口味': '5.0', '环境': '5.0', '服务': '5.0', '性价比': '5.0'}"
{'$oid': '665dad89206d76c065d5ba0e'},偶遇这家店，想到好几年前的网红店啦！排队人不多，就直接买了二个定制盒子啦！属于招牌款！第一个盒子➕抹茶，奥利奥碎！抹茶建议一个小时内吃完或进冰箱，易化，尝了口，淡清香的抹茶味，不腻，不甜，不错！冷藏后口感更好！第二个盒子➕黑芝麻+原味肉松，浓香黑芝麻，好吃😋，个人偏咸口！喜欢脆脆的可以➕海苔肉松！偶尔吃吃可以，用料扎实，价格美丽！,['定制虎皮盒子'],2024-05-18 15:36,4.5,"{'口味': '4.5', '环境': '4.5', '服务': '4.5', '性价比': '4.5'}"
{'$oid': '665dad89206d76c065d5ba0e'},刷到很多推荐于是到武汉第一口就是佳哥 本来不抱什么期待手作店铺天盖地 看到价格还是蛮惊讶的总体来说性价比非常高 「抹茶奶冻虎皮卷」其他店可以卖28了吧 蛋糕体绵软奶冻奶油都主打健康不甜腻 因为没有冰箱胃口有限没有尝试盒子和麻薯 只能买一点耐储存的 唯一的缺点是人一多排队取东西还蛮混乱的 肉松老婆饼推荐非常扎实的一个,['抹茶奶冻虎皮卷'],2024-05-15 00:52,4.5,"{'口味': '5.0', '环境': '4.5', '服务': '4.5', '性价比': '5.0'}"
{'$oid': '665dad89206d76c065d5ba0e'},去江汉路必买佳哥，几年前体重管理时佳哥家是我唯一敢吃的面包店。那时经常买的是他家的全麦面包，魔芋蛋糕，虽说无糖无油，除啦非常干以外与其他面包无异。猪瘾犯了正好解馋。 五一当天江汉路人山人海，佳哥家大排长龙。我耐心的等待，终于快到了，我就在想点什么东西，免得到我了再点会耽误时间。我要了蔓越莓麻薯和抹茶麻薯，斑斓蛋糕，虎皮盒子，奶酪球，肉松咸蛋黄饼。虎皮盒子我要的麻薯肉松流沙的。忘记拍照瞬间炫完了。斑斓蛋糕很好吃，淡奶味浓郁，奶油柔滑味道带一点茶苦。我很喜欢。麻薯不甜，肉松咸蛋黄饼非常好吃，肉松特别多特别扎实。 佳哥家的糕点真的吃着没有负担，能吃出来用料好，少油少糖。而且价格比武汉本土其他蛋糕店便宜。这应该就是佳哥风靡武汉三镇的原因吧。 照片少是因为都吃得差不多了才想起来要评论。其实随便买也不会踩雷。很遗憾我一直没吃到过佳哥家欧包。这个五一假期横竖要去买到。,"['定制虎皮盒子', '蔓越莓味麻薯', '巧克力小麻薯', '芋泥芝士丸子', '咸蛋黄肉松饼', '芋泥黑芝麻流沙肉松虎皮盒子', '无油无糖黑麦', '抹茶麻薯', '全麦面包']",2024-05-03 09:32,4.5,"{'口味': '4.5', '环境': '4.5', '服务': '4.5', '性价比': '4.5'}"
{'$oid': '665dad89206d76c065d5ba0e'},终于吃到黑虎皮了！！！ 一直都是👀别人吃黑虎皮，奈何各种原因，一直没吃到，终于有机会预定到了 🌸黑虎皮➕麻薯➕奥利奥➕抹茶奶油➕海苔肉松 这个是看评论中草的，这个是谁想出来的，太好吃了！！！第一口就爱上了，我本身是不爱抹茶的，但是佳哥的抹茶是真的好吃，微苦，茶味，加上奥利奥是绝配 敲黑板，佳哥的抹茶和黑芝麻都非常棒，做盒子做虎皮卷做麻薯球都很赞，这个盒子17块钱，性价比绝绝子 🍀芋泥可可魔芋卷，这个没吃过，第一次吃，第一口，没味道，没有任何味道，口感有点偏干，如果吃惯那种普通面包的这个肯定不习惯，虽然谈不上味如嚼蜡，但是也谈不上好不好吃，只能说能不能接受。这个吃了一半才隐约有种食物本身的香味，慎点。  #爱上了中式下午茶,[],2024-05-03 07:31,4.5,"{'口味': '5.0', '环境': '4.5', '服务': '5.0', '性价比': '4.5'}"
{'$oid': '665dad89206d76c065d5ba0e'},佳哥手作在武汉也算是连锁店。仅仅江汉路就开了两家。可以说明他的受欢迎程度。 这家位于江汉路步行街和中山路的交叉点上。交通很便利，地铁2号线直达。 家里的小朋友很喜欢，特意从武昌到这家店来。她排队的时候，我站在店角落里刷手机。有人在我身边放了一张凳子，说坐着休息会儿吧，就走开了。只看到一个背影，也不知道是店员还是什么人。让人感觉很温暖。,[],2024-03-07 13:27,4.5,"{'口味': '4.5', '环境': '4.5', '服务': '5.0', '性价比': '4.5'}"
{'$oid': '665dad89206d76c065d5ba0e'},「定制虎皮盒子」正好路过~工作日排队并不长就买了~我要的是芋泥➕流心蛋黄➕抹茶➕脆海苔松肉~然后还买了两个「芋泥开心果奶酪球」  [樱花]性价比: 确实是不错的~口味能定制这个就真的很人性化~  注意💢： 点单前想好要买啥~人多的时候到了收银那边加东西可能就加不上！！！要重新排队……,['定制虎皮盒子'],2024-05-22 15:34,4.0,"{'口味': '4.5', '环境': '2.5', '服务': '2.5', '性价比': '4.0'}"
{'$oid': '665dad89206d76c065d5ba0e'},武汉|纯坊佳哥手作🍞  尝尝风很大的佳哥手作啦～ 刚好路过， 工作日早一点的话都不用排队。 再次路过几次， 下午到傍晚都在排队。  口味： 盲选了三个，因为妈妈和姨妈爱吃肉松选的都是肉松的。我只想吃个芋泥的，一眼就看到一个芋泥的卷就点啦。  「香葱火腿卷」 香葱蛋糕卷肉松特别多！身边两位肉松爱好者们表示一口停不下来因为肉松真的太多太香了。香葱的葱香搭配也是恰到好处。性价比是真的高  「芋泥魔芋卷」 一眼看到的盲选的一个芋泥的卷。吃起来真的很扎实，不甜，芋泥厚重，很突出芋泥本身的味道。爱了爱了。好爱不甜的芋泥！  「原味肉松小贝」 还买了一个肉松小贝，晚上回去加餐。满满的肉松，松松软软的蛋糕胚。  三个一共¥21.7，用料扎实，性价比蛮高。,[],"2024-04-25
  更新于2024-04-26 13:32",5.0,"{'口味': '5.0', '环境': '5.0', '服务': '5.0', '性价比': '5.0'}"
{'$oid': '665dad89206d76c065d5ba0e'},很喜欢佳哥家的抹茶奶冻虎皮卷，但是没有拍照记录，微苦的抹茶奶油中间一大块奶冻，冰冰凉凉的超级好吃，芋泥奶冻卷也是，芋泥是很纯朴的味道，食物本身的清香，佳哥家的奶冻真的狠狠喜爱上了，冰冰凉凉微甜不腻 香葱肉松蛋糕卷，一口爱上的品，肉松脑袋大满足，混合着奶香的沙拉酱，整一个甜咸永动机喜欢死了 司康简直是性价比之神，这么大一块才2.5左右，黄油香很足也很好吃 定制盒子虎皮卷真的很推荐抹茶奶油，黑芝麻，芋泥，加海苔肉松，吃不腻真的吃不腻,['定制虎皮盒子'],2024-05-05 18:35,5.0,"{'口味': '5.0', '环境': '5.0', '服务': '5.0', '性价比': '5.0'}"
{'$oid': '665dad93206d76c065d5ba10'},-☁☀️🎶⛱️ 今天也是一枚普通的女子 一如既往地热爱生活🌿“境随心转” 把自己变成糖，生活就甜了 隐藏在西北湖的一处小清新，要不是闺蜜带着都不知道的地儿。环境优雅，很有人气，常常没有位置。口感不错，其实品的是种意境，一种氛围。,[],2024-04-02 21:55,4.0,"{'口味': '4.0', '环境': '4.0', '服务': '4.0'}"
{'$oid': '665dad93206d76c065d5ba10'},一家隐藏在中古店里的咖啡馆，咖啡店面整体位置不大，但是很精致，各式各样的杯子供选择，每一个都好好看，店里小姐姐都非常有礼貌。,['冰美式'],2023-11-28 17:39,4.0,"{'口味': '3.5', '环境': '3.5', '服务': '4.5'}"
{'$oid': '665dad93206d76c065d5ba10'},[薄荷]环境： 去的时候人还挺多的，基本都坐满了，只有外面还有一个桌子。整个店设计风格还挺好看的。 口味： 点了两杯店员推荐的咖啡☕️口感不错～  外面铺了石子路比较适合拍照，里面好像有个古着店是一起的，也没进去逛，就坐着跟朋友喝了下咖啡聊聊天。也挺舒服的～,"['巴斯克焦烧芝士', '扁桃仁拿铁']",2023-10-10 16:52,4.5,"{'口味': '4.5', '环境': '4.5', '服务': '4.0'}"
{'$oid': '665dad93206d76c065d5ba10'},花园道这一条真的很值得多逛逛，每次去都会发现不一样的景色。  这家咖啡厅在一个小院子里，进门第一家就是。  店里看着不大但是跟旁边的中古店连着的，去的时间刚营业，桌子上好多花花，还以为是间花店..hhh  老板娘说是刚买了。还没来得及整理，叫我随便坐。我一个人去的还比较拘谨。不过店员妹妹和老板娘都挺热情的。,[],2023-08-03 09:51,5.0,"{'口味': '5.0', '环境': '5.0', '服务': '5.0'}"
{'$oid': '665dad93206d76c065d5ba10'},📍位置： 西北湖路13号 [薄荷]环境： 和一家中古店是连通的店面不大室内三张桌子也可以选择坐在室外 [服务铃]服务： 咖啡师小姐姐很友好饮品可以选择杯子都是店主收藏的但是仅限在室内用哦 出品： 「冰拿铁」杯量不大味道中规中矩拉花好看,['冰拿铁'],2023-07-30 16:53,4.5,"{'口味': '4.5', '环境': '4.5', '服务': '5.0'}"
{'$oid': '665dad93206d76c065d5ba10'},和朋友约在花园道附近，偶然走进来发现是家小咖啡馆，咖啡说实话蛮普通的，当然价格也比较便宜，店主人蛮好的，温温柔柔的女孩子，感觉开这样的一家店也不是为了赚钱，花了心思布置，只是为了让自己有个呆着舒服的地方吧。,[],2023-08-02 17:29,4.0,"{'口味': '3.0', '环境': '3.5', '服务': '4.0'}"
{'$oid': '665dad93206d76c065d5ba10'},咖啡味道还不错，店内也很适合拍照打卡。,"['巴斯克焦烧芝士', '冰美式', '厚椰乳拿铁']",2023-09-21 11:20,5.0,"{'口味': '5.0', '环境': '5.0', '服务': '5.0'}"
{'$oid': '665dad93206d76c065d5ba10'},老板娘超级温柔，自己带的小蛋糕，借了一个盘，超级安静，和朋友在店里玩了半天，推荐推荐,[],2023-08-21 11:14,5.0,"{'口味': '5.0', '环境': '5.0', '服务': '5.0'}"
{'$oid': '665dad93206d76c065d5ba10'},喜欢他家的杯子收藏据说是日本定制,[],2023-10-10 14:11,4.5,"{'口味': '5.0', '环境': '4.5', '服务': '4.5'}"
{'$oid': '665dad93206d76c065d5ba10'},[薄荷]环境：超多好看的杯子和惊喜～,[],"2023-08-13
  更新于2023-08-14 00:42",5.0,"{'口味': '5.0', '环境': '5.0', '服务': '5.0'}"
{'$oid': '665dad93206d76c065d5ba10'},冰美式和手冲都蛮不错的，地段在西北湖，喝完咖啡还可以去边转转，还可以自己选杯子哦～,"['冰美式', 'Z+手冲']",2023-08-04 11:18,5.0,"{'口味': '4.5', '环境': '4.5', '服务': '5.0'}"
{'$oid': '665dad93206d76c065d5ba10'},[薄荷]环境： 一开始以为是蛮大的店子，去了之后发现是蛮小的一个小小铺，里面大概三张小圆桌子  出品： 咖啡的话属于中规中矩的咖啡，家里用咖啡机做出来的味道，如果偶尔有机会路过可以来尝一尝，但是我大老远的跑过来就没必要 斯巴克蛋糕，味道整体还可以配着咖啡吃的话，没有那么容易腻和自己的好闺蜜做一两个小时，歇歇脚是个可以的地方。 如果想拍照的话，感觉不是很适合，比较小的店店，实在要拍的话就选个天气好的,"['巴斯克焦烧芝士', 'Z+手冲']",2023-06-01 18:37,3.0,"{'口味': '3.5', '环境': '3.5', '服务': '3.5'}"
{'$oid': '665dad93206d76c065d5ba10'},在一家小巷子根据导航找半天以为在马路牙子上谁知道在这个门里 店内不大但店外可以坐很多小妹妹来打卡拍照感觉单纯来喝咖啡的都有点突兀店内外都在拍照赶紧喝完走了咖啡种类很多找个工作日来坐下聊聊天感觉还是不错的,[],2023-06-01 17:53,4.0,"{'口味': '3.5', '环境': '3.5', '服务': '3.5'}"
{'$oid': '665dad93206d76c065d5ba10'},口味： 很好看也很好吃老板非常会做！还在培训员工！ 出品： 好看好看好看甜品非常有颜值！还有咖啡用的杯子都是限量版的非常好看很适合拍照有点复古风的味道 [薄荷]环境： 复古ins的感觉里面还有一个奢侈品包包店是一起的 喝咖啡的时候还可以去看看包包 [服务铃]服务： 老板和服务员态度都非常好,"['青提气泡', 'Z+手冲', '厚椰乳拿铁']",2023-05-28 11:57,5.0,"{'口味': '5.0', '环境': '5.0', '服务': '5.0'}"
{'$oid': '665dad93206d76c065d5ba10'},很有氛围的一家咖啡小店，在路边的老建筑里，门口有一个户外小院子#因为在附近公园玩，在大众上看到的这家店，就来试试，果然没失望#虽在老房子里，但是装饰风格很舒服，店里干净温馨，咖啡和蛋糕都很棒，这个套餐很划算,[],2023-05-06 09:39,4.5,"{'口味': '4.5', '环境': '4.5', '服务': '4.5'}"
{'$oid': '665dad97206d76c065d5ba12'},店名很独特，店比较小，甜品味道还不错。去晚了有些已经售罄。 店内比较小，感觉应该是老店了，有一些linefriends的周边，还算可爱。餐具也挺可爱的，不过有些餐具有些破损会影响出片。 如果整体格局环境和餐具上再注意更美观一点，效果应该会更好,[],2024-05-17 14:27,4.0,"{'口味': '4.0', '环境': '4.0', '服务': '4.0', '性价比': '4.0'}"
{'$oid': '665dad97206d76c065d5ba12'},《没有名字的甜品店》，我记得是一部台湾的治愈美食电视剧。好像这家店的老板也是台湾人，特地买了老板从台湾背回来的大橄榄。这是家非常可爱的店子，被同事带过来，一进门就爱了。店面不大，很干净整洁，让人感觉很温暖，老板娘也很温柔。每个蛋糕都很漂亮，让人舍不得下口，味道不腻很清爽。,[],2024-04-01 16:22,5.0,"{'口味': '5.0', '环境': '5.0', '服务': '5.0', '性价比': '5.0'}"
{'$oid': '665dad97206d76c065d5ba12'},一家“🐻出末”的甜品店  [薄荷]环境： 武汉市政府旁边的小路，看到一元路小学后左转往前走三分钟就可以看到这个店啦，门头不大，这一看就是主要做小学和小区生意的啦。但这种才是好，酒好不怕巷子深，我反而不爱那种装修特华丽的网红店。店里好多布朗🐻出现呀 原料：据说是动物奶油，因为会化，我还是吃得出来的，确实是的。  口味： 「榛子布朗」今天天气热，有20度，拿回去，熊的图案被我抖掉啦，但味道不错的，里面是巧克力奶油。「原味芝士」这个焦糖味浓，不够吃啊。  [樱花]性价比： 我买的「原味芝士」20，「榛子布朗」18，价格比有些小店要贵一点，但这地段，还有用的原料，也可以理解啦。,"['榛子布朗', '原味芝士']",2023-12-08 21:06,4.5,"{'口味': '4.5', '环境': '4.5', '服务': '4.5', '性价比': '4.0'}"
{'$oid': '665dad97206d76c065d5ba12'},口味：两个蛋糕感觉味道一般吧，不过价格也不贵。  原料：不甜腻的蛋糕，也是很可爱的甜品小造型啦，应该会有很多小朋友喜欢，  [薄荷]环境：老板很热情，店里的位置比较小，很多都是附近上学的孩子过来吃。  路过的话可以去尝一尝。,[],2024-04-17 11:11,3.0,"{'口味': '3.0', '环境': '3.0', '服务': '3.0', '性价比': '3.0'}"
{'$oid': '665dad97206d76c065d5ba12'},在收藏夹里躺了很久的一家私房蛋糕店，周六店休，而每次路过总在周六🫣元旦假期总算打卡了。可能是假期，蛋糕的产品只剩几样，想吃的芋泥系全没有，最后挑了两个“偏门”，一袋辣橄榄一个老婆饼，台湾特色嘛😅，味道都不错。 橄榄酸甜，后味微辣，十分开胃解馋，老婆饼内馅好于酥皮，皮带奶香可有点干硬了，馅微糯微沙微甜，有点台味。 怀念台湾宜兰的糕饼,[],2024-01-02 14:16,3.5,"{'口味': '3.5', '环境': '3.5', '服务': '4.5', '性价比': '3.5'}"
{'$oid': '665dad97206d76c065d5ba12'},爽吃绵绵冰！草莓过季了还挺酸，芒果跟菠萝超甜！ 中午来吃，进口非常清爽，一人一份毫无压力～～ 带走了一罐曲奇，口感很细腻又不会过分甜，下次再来吃吃其他的,[],2024-04-14 21:20,4.5,"{'口味': '4.5', '环境': '4.5', '服务': '4.5', '性价比': '4.0'}"
{'$oid': '665dad97206d76c065d5ba12'},朋友从外地来做过功课的打卡小店，在武汉这么久也是我第一次来。店子氛围挺温柔的。甜品还不错，比较适合citywalk中间来个茶歇。,[],2024-05-12 16:01,4.0,"{'口味': '4.0', '环境': '4.0', '服务': '4.0', '性价比': '4.0'}"
{'$oid': '665dad97206d76c065d5ba12'},[薄荷]环境： 门面和店面都比较小，只有几桌可以坐着休息，像开在学校门口小甜品店的装修。 口味： 个人感觉比较一般，纯甜。看了推荐抱了很大期待特地找去，很让人失望。 [樱花]性价比： 人均30左右，也不贵，就是这种小店性价比太低了。,[],2024-01-11 08:48,3.5,"{'口味': '3.0', '环境': '3.5', '服务': '5.0', '性价比': '3.5'}"
{'$oid': '665dad97206d76c065d5ba12'},挺温馨的一家小店，在附近玩累了，正好路过就进去歇一会。甜品造型都很可爱，尝试了椰子慕斯，奶香浓郁。提拉米苏的造型个人比较喜欢，还点了红豆绵绵沙，甜度刚好，又不会太甜。生椰拿铁用的是一次性的杯子，感觉不那么精致，和店里其他东西不搭配。店里到处是小熊，童心童趣。,['红豆炼奶'],2023-09-20 14:26,4.5,"{'口味': '5.0', '环境': '5.0', '服务': '4.5', '性价比': '4.5'}"
{'$oid': '665dad97206d76c065d5ba12'},非常可爱的店子，虽然本来是想喝东西但是没有饮品只有甜品但是确实被可爱到了,[],2024-01-09 15:55,4.0,"{'口味': '4.0', '环境': '4.0', '服务': '5.0', '性价比': '5.0'}"
{'$oid': '665dad97206d76c065d5ba12'},没有名字的甜品店，在洞庭街上，看完知音号以后热得不行，吃一个这个非常解暑。水果绵绵冰应该算是他们家的招牌之一，牛奶绵绵冰打底，搭配各种应季水果芒果，提子，火龙果。他们家的装饰是很可爱的布朗熊，还有很多在台湾得的奖状，感觉其他甜品应该也很nice～,[],2023-09-25 21:24,4.0,"{'口味': '4.0', '环境': '4.0', '服务': '4.0', '性价比': '3.5'}"
{'$oid': '665dad97206d76c065d5ba12'},很有特色的台式点心店，在旁边定做衣服的时候，老板推荐的，之后一发不可收拾，每个月总要买点特色的，芋头酥和红豆酥真的百吃不腻。,[],2024-02-13 20:54,4.5,"{'口味': '4.5', '环境': '4.5', '服务': '4.5', '性价比': '4.5'}"
{'$oid': '665dad97206d76c065d5ba12'},在江滩附近逛完，正好有点空档，想吃点甜品稍微休息一下，就搜到了这家，门面小小的不起眼，进来发现别有洞天，风格偏韩系小清新，甜品颜值也都很高。 被布朗熊和小黄鸭吸引了，分别是巧克力和芒果慕斯，造型可可爱爱，入口即化，甜度把握刚刚好不会甜腻，巧克力的味道偏黑巧很浓郁，芒果味能尝出芒果的清香，出乎意料的好吃！ 看了下店里挂的介绍，店主应该是个蛮厉害的台湾甜品师，得过很多奖。临走我们又带了四个凤梨酥，尝尝是不是之前在台湾的味道～下次来武汉再让对象试试他心心念念的榴莲芝士吧,"['小黄鸭', '布朗熊']",2023-09-10 16:43,5.0,"{'口味': '5.0', '环境': '5.0', '服务': '5.0', '性价比': '5.0'}"
