_id,评论内容,喜欢的菜,发布时间,用户总分,用户打分
{'$oid': '6676ca894a1b56542585c488'},店在乐天城一楼，进大门直走到头就到了，很容易找，店内环境很不错，下单后，菜品很快就上上来了，品质都很不错，全程有服务员小姐姐帮烤，烤的很好，有自助的小料和生菜包着吃很解腻。主食是自助的。扫码点单就可以，可以无限续。,[],2024-06-16 20:46,4.5,"{'口味': '4.5', '环境': '4.5', '服务': '4.5'}"
{'$oid': '6676ca894a1b56542585c488'},菜品味道很好，生菜小菜小料无限续，主食也是无限续，环境也很舒服，服务员态度积极，反馈也很快，适合和朋友过来聚餐聊天。,[],2024-06-16 20:10,5.0,"{'口味': '5.0', '环境': '5.0', '服务': '5.0'}"
{'$oid': '6676ca894a1b56542585c488'},味道很好，菜品看起来很精致，尤其是主食进行了升级，味道都很不错。,[],2024-06-16 19:48,4.5,"{'口味': '4.5', '环境': '4.5', '服务': '4.5'}"
{'$oid': '6676ca894a1b56542585c488'},朋友带的来吃的觉得很划算肉质也比较新鲜性价比很高啦！！！！！！,[],2024-06-16 19:12,4.5,"{'口味': '4.5', '环境': '4.5', '服务': '4.5'}"
{'$oid': '6676ca894a1b56542585c488'},烤肉很好吃，小姐姐的服务也很贴心，换烤盘的次数也很勤快，下次还会来啦,"['雪花猪颈肉', 'IBP雪花肥牛']",2024-06-16 18:01,4.5,"{'口味': '4.5', '环境': '4.5', '服务': '4.5'}"
{'$oid': '6676ca894a1b56542585c488'},肉质鲜美，调味恰到好处，服务热情周到，环境雅致舒适，每一口都是幸福的滋味，强烈推荐！,[],2024-06-16 17:58,4.5,"{'口味': '4.5', '环境': '4.5', '服务': '4.5'}"
{'$oid': '6676ca894a1b56542585c488'},非常好非常好，服务员唇钉特别好看，好吃好吃，推荐推荐,[],2024-06-16 14:12,4.5,"{'口味': '5.0', '环境': '5.0', '服务': '4.5'}"
{'$oid': '6676ca894a1b56542585c488'},这家烤肉店非常不错，在街道口地铁出来就是的，不会烤他还帮你烤，服务很到位,['五种烤肉'],2024-06-16 13:27,4.5,"{'口味': '4.5', '环境': '4.5', '服务': '4.5'}"
{'$oid': '6676ca894a1b56542585c488'},口味 味道不错带孩子来吃，孩子很喜欢吃这里的主食，免费还不限量。 环境 环境不错卫生搞得很干净。 服务 服务员态度不错，帮烤。 值得推荐街道口玖段烤肉,[],2024-06-16 13:23,5.0,"{'口味': '5.0', '环境': '5.0', '服务': '5.0'}"
{'$oid': '6676ca894a1b56542585c488'},跟朋友买了优惠券一起去吃，本来没抱太大希望的，但是意外的很好吃，南瓜糊糊味道很棒，适中，不甜就是最棒的，肉和香肠也好吃，还赠送了米饭和辛拉面，但是辛拉面有点慢导致煮软了，口感一般但是味道是好的，下次还要去吃！！,"['黑猪排骨五花肉', '玖段招牌厚切五花肉', '爆品南瓜粥', '石锅拌饭']",2024-06-15 23:13,4.5,"{'口味': '4.5', '环境': '4.5', '服务': '5.0'}"
{'$oid': '6676ca894a1b56542585c488'},环境 很有韩剧的感觉，他们家的一些小吃也非常不错 跟小孩一起出去，小孩很喜欢他们家的冰淇淋面包 口味 烤肉特别好吃，推荐菜是五花肉和鸡腿肉还有牛排 位置 乐天城一楼最里面,"['爆品南瓜粥', '玖段招牌厚切五花肉', '雪花猪颈肉', 'IBP雪花肥牛', '和牛上脑牛排', '生菜', '玉米沙拉']",2024-06-15 21:17,5.0,"{'口味': '5.0', '环境': '5.0', '服务': '5.0'}"
{'$oid': '6676ca894a1b56542585c488'},非常好吃环境好网络不错真的很好吃不错不错推荐大学生来吃巴适得板,[],2024-06-15 19:17,4.5,"{'口味': '4.5', '环境': '4.5', '服务': '4.5'}"
{'$oid': '6676ca894a1b56542585c488'},口味 味道不吃，肉新鲜，爱吃这里的牛排。 环境 环境还可以看着很舒服，沙发位最好。 服务 服务员态度可以的。 街道口玖段推荐。,[],2024-06-15 19:08,5.0,"{'口味': '5.0', '环境': '5.0', '服务': '5.0'}"
{'$oid': '6676ca894a1b56542585c488'},位置在乐天城一楼非常好找，环境优雅干净，服务员热情周到，最绝的就是菜品了，烤肉肥而不腻，口口留香，牛肉鲜美可口，筋道美味，服务员会贴心为我们烤到最佳风味，量身定制每位用户的独到口味，性价比非常高，值得一试！,[],2024-06-15 18:10,5.0,"{'口味': '5.0', '环境': '5.0', '服务': '5.0'}"
{'$oid': '6676ca894a1b56542585c488'},菜的味道超级好，烤肉小哥也非常热情，总体来说对这家店非常满意，下次还来！,[],2024-06-15 13:19,5.0,"{'口味': '5.0', '环境': '5.0', '服务': '5.0'}"
{'$oid': '6676ca894a1b56542585c488'},还可以很适合学生党去吃可以打折吃的也很饱,[],2024-06-15 12:00,3.5,"{'口味': '4.5', '环境': '3.5', '服务': '3.5'}"
{'$oid': '6676ca894a1b56542585c488'},体验是真心不错，每道菜的分量都挺多的，而且点的菜都没有踩雷，服务员每次上菜都会很贴心的介绍菜品性价比很高，菜品量足，味道也好，已经想好下次来要点什么了用餐很愉快，服务员很热情纸巾，餐具，卫生处处都很有细节蛮用心的一家餐厅，菜品用的食材都很好，菜系也很丰富服务员的介绍很仔细对待客人很热情他们家的拌饭真的可以试一试一口下去非常好吃快来品尝吧[飞吻R],"['黑猪排骨五花肉', '爆品南瓜粥', '玖段招牌厚切五花肉', '石锅拌饭']",2024-06-14 23:09,5.0,"{'口味': '5.0', '环境': '5.0', '服务': '5.0'}"
{'$oid': '6676ca894a1b56542585c488'},南瓜汤非常正宗，瓜味很浓，烤肉也很新鲜，而且拌饭是不限量的，拼盘对于食量小的人特别友好，可以兼顾的吃到很多种类的肉，推荐哦,[],2024-06-14 20:52,4.5,"{'口味': '4.5', '环境': '4.5', '服务': '5.0'}"
{'$oid': '6676ca894a1b56542585c488'},可以帮烤肉，服务好，菜量也合适，适合几个朋友一起，,[],2024-06-14 20:48,5.0,"{'口味': '5.0', '环境': '5.0', '服务': '5.0'}"
{'$oid': '6676ca894a1b56542585c488'},服务态度好食品美味环境好有拉面可以免费续,[],2024-06-14 20:39,4.5,"{'口味': '5.0', '环境': '5.0', '服务': '5.0'}"
{'$oid': '6676ca894a1b56542585c488'},烤肉很好吃，食材也比较新鲜，性价比高，吃了几年了，服务态度也非常好，希望大家支持他们！,[],2024-06-14 18:41,5.0,"{'口味': '5.0', '环境': '5.0', '服务': '5.0'}"
{'$oid': '6676ca894a1b56542585c488'},偶然走进的烤肉店，特别惊喜，肉和虾都很新鲜，烤完味道特别好，烤肉酱也很喜欢，服务员特别和蔼主动续生菜，免费的南瓜粥和肥牛饭也很好吃,[],2024-06-14 18:20,5.0,"{'口味': '5.0', '环境': '5.0', '服务': '5.0'}"
{'$oid': '6676ca894a1b56542585c488'},这家烤肉店真的性价比超高，第一次团购，感觉肉类非常的新鲜，而且品种丰富，主食和南瓜粥都可以免费续，服务态度都特别好！！推荐推荐还会再来！！,"['黑猪排骨五花肉', '爆品南瓜粥', '玖段招牌厚切五花肉', '石锅拌饭', '五种烤肉']",2024-06-14 18:19,5.0,"{'口味': '5.0', '环境': '5.0', '服务': '5.0'}"
{'$oid': '6676ca894a1b56542585c488'},口味： 味道非常不错，牛排烤的很嫩，孩子很爱吃， 环境： 干净卫生，看着很舒服。 服务： 服务非常好，服务员态度也非常好。 街道口玖段非常推荐！,[],2024-06-14 17:33,5.0,"{'口味': '5.0', '环境': '5.0', '服务': '5.0'}"
{'$oid': '6676ca894a1b56542585c488'},口味： 味道不错带孩子来吃的孩子很喜欢，菜品新鲜，排盘非常精致。 环境： 环境不错，卫生干净，适合家庭聚餐， 服务： 服务态度好，全程帮烤，自己坐等吃就行了。 非常推荐这家街道口玖段烤肉店！,[],2024-06-14 17:33,5.0,"{'口味': '5.0', '环境': '5.0', '服务': '5.0'}"
{'$oid': '6676ca894a1b56542585c488'},口味很好，价格适中，和朋友聚餐的好去处。而且烤肉的小姐姐很负责，感谢🏻,[],2024-06-14 17:27,5.0,"{'口味': '5.0', '环境': '5.0', '服务': '5.0'}"
{'$oid': '6676ca894a1b56542585c488'},服务员帮烤全程都很耐心也很及时的告诉我们哪些肉可以吃了，猪颈肉超级弹牙根本吃不够。主食很贴心的都给了小份，这样每种口味都可以尝一下，反正是免费不限量的。南瓜粥一如既往的好喝，并且也是免费续。总之就是非常不错！,['雪花猪颈肉'],2024-06-13 23:48,5.0,"{'口味': '5.0', '环境': '4.0', '服务': '5.0'}"
{'$oid': '6676ca894a1b56542585c488'},牛肉鲜美各种烤肉味道都很好服务态度很好学生标配下次还来！,[],2024-06-13 20:45,4.5,"{'口味': '4.5', '环境': '4.5', '服务': '4.5'}"
{'$oid': '6676ca894a1b56542585c488'},味道很好，送的东西也多，环境也不错，值得过来试试。,[],2024-06-13 17:53,4.5,"{'口味': '4.0', '环境': '4.0', '服务': '4.0'}"
{'$oid': '6676ca894a1b56542585c488'},环境优美，服务到位，菜品新鲜，味道鲜美，good,[],2024-06-13 17:52,4.5,"{'口味': '5.0', '环境': '5.0', '服务': '5.0'}"
{'$oid': '6676ca894a1b56542585c488'},菜品非常新鲜，环境也很不错。烤肉味道很好，值得一试。店员服务也很周到！,[],2024-06-13 11:31,5.0,"{'口味': '5.0', '环境': '5.0', '服务': '5.0'}"
{'$oid': '6676ca894a1b56542585c488'},菜品好吃，服务周到，好吃好吃好吃好吃😋,[],2024-06-12 12:17,4.5,"{'口味': '4.5', '环境': '4.5', '服务': '5.0'}"
{'$oid': '6676ca894a1b56542585c488'},肉质比较新鲜，服务员烤肉可以因为要兼顾别的桌子，会把肉烤焦,[],2024-06-12 11:00,4.0,"{'口味': '3.5', '环境': '4.0', '服务': '3.5'}"
{'$oid': '6676ca894a1b56542585c488'},在繁忙的街道口乐天城，我发现了一家令人惊喜的烤肉店——玖段烤肉·原切厚牛排。从踏入店门的那一刻起，我就被这里温馨而现代的装修风格所吸引。店内的灯光柔和，营造出一种轻松愉悦的用餐氛围。  服务：服务员们热情周到，从推荐菜品到烤肉技巧的分享，都让人感到宾至如归。他们对食材的了解和对顾客需求的敏锐洞察，让我对这家店的印象分外深刻。  食物：说到食物，这里的原切厚牛排绝对是主角。肉质鲜嫩多汁，每一口都是对味蕾的极致诱惑。烤肉在炭火上烤至完美的焦香，搭配店家特制的酱料，简直是人间美味。  环境：店内环境干净整洁，每张桌子都有足够的空间，让人在享受美食的同时，也能享受到舒适的用餐体验。  总结：玖段烤肉·原切厚牛排（街道口乐天城店）无疑是我近期最满意的用餐体验之一。无论是食物的质量，还是服务的水平，都让我感到十分满意。强烈推荐给喜欢烤肉的朋友们，相信你们也会和我一样，爱上这里的一切。,[],2024-06-12 10:54,5.0,"{'口味': '5.0', '环境': '5.0', '服务': '5.0'}"
{'$oid': '6676ca894a1b56542585c488'},口味： 五花肉很喜欢吃烤的肥而不腻， 环境； 很不错干干净净，看着舒服，歌也喜欢听。 服务； 服务不错，服务员态度都可以。 街道口的玖段,[],2024-06-11 20:42,5.0,"{'口味': '5.0', '环境': '5.0', '服务': '5.0'}"
{'$oid': '6676ca894a1b56542585c488'},味道吃起来很不错，价格非常实惠，特别的优惠。是一家可以多次尝试的烤肉,[],2024-06-11 19:23,4.5,"{'口味': '5.0', '环境': '5.0', '服务': '5.0'}"
{'$oid': '6676ca894a1b56542585c488'},久违返玖段！味道还是一如既往的好，食材很新鲜！服务态度好，最爱的烤肉店,[],2024-06-11 19:13,5.0,"{'口味': '5.0', '环境': '5.0', '服务': '5.0'}"
{'$oid': '6676ca894a1b56542585c488'},口味 不错肉也新鲜跟朋友一起吃很喜欢南瓜粥最喜欢很甜很喜欢 环境 卫生可以的有歌吃着烤肉很喜欢 服务 服务员态度很好帮烤就管吃就行了 街道口玖段烤肉真的很推荐,[],2024-06-11 12:47,5.0,"{'口味': '5.0', '环境': '5.0', '服务': '5.0'}"
{'$oid': '6676ca894a1b56542585c488'},这家烤肉店真是太棒了！肉质鲜嫩多汁，烤得恰到好处，香气四溢。蘸料味道浓郁，让人食欲大增。服务员态度热情周到，整个用餐过程都非常愉快。下次一定还要再来！(☆▽☆),[],2024-06-11 12:25,4.5,"{'口味': '4.5', '环境': '4.5', '服务': '4.5'}"
{'$oid': '6676ca894a1b56542585c488'},新发现的烤肉店，超好吃很惊喜，性价比也很高，全部光盘了，好吃！,[],2024-06-10 19:32,5.0,"{'口味': '5.0', '环境': '5.0', '服务': '5.0'}"
{'$oid': '6676ca894a1b56542585c488'},姐妹们今天跟男友出来玩发现了一家超好吃的烤肉店！好吃到翘jiojio！,[],2024-06-10 17:45,4.5,"{'口味': '4.5', '环境': '4.5', '服务': '4.5'}"
{'$oid': '6676ca894a1b56542585c488'},味道相当不错，菜品健康，在武汉位置相当好的地方,[],2024-06-10 17:19,4.5,"{'口味': '4.5', '环境': '4.5', '服务': '4.5'}"
{'$oid': '6676ca894a1b56542585c488'},在这家店吃过好多次了，带着朋友们也来过好多次！首先这家店的主食有米饭和面条都是韩式的，这些全是免费无线续的，一些南瓜粥和小食生菜也是免费续，整体而言还是比较划算。烤肉的话可以请服务人员帮忙考，服务很到位！,[],2024-06-10 16:59,3.5,"{'口味': '3.5', '环境': '3.5', '服务': '3.5'}"
{'$oid': '6676ca894a1b56542585c488'},口味 推荐五花肉！烤的外焦里嫩非常好吃！牛排也很嫩，主食免费不限量。 环境 环境不错光线很好拍照好看，卫生也很干净 服务 服务态度也很好 非常推荐来,[],2024-06-10 14:19,4.5,"{'口味': '4.5', '环境': '4.5', '服务': '4.5'}"
{'$oid': '6676ca894a1b56542585c488'},烤肉口感不错，烤起来快，分量足！,[],2024-06-09 20:12,4.5,"{'口味': '5.0', '环境': '5.0', '服务': '5.0'}"
{'$oid': '6676ca894a1b56542585c488'},肉类都很新鲜，牛肋条很嫩，五花肉和肥牛也很香，服务很周到，换烤盘很及时，推荐来吃呀哈哈哈哈！！！,[],2024-06-09 20:06,4.5,"{'口味': '4.5', '环境': '4.5', '服务': '4.5'}"
{'$oid': '6676ca894a1b56542585c488'},【烤肉拼盘】烤肉类都非常新鲜，配的酱汁品种也很多，有黄芥末酱烤肉酱之类。两个人吃刚刚好。 【小菜拼盘】有沙拉玉米，泡菜和豆腐干 【主食】有咖喱猪排饭和拉面之类，可以无限续。 饮料品种比较单一，可以多加点饮品品种。,"['黑猪排骨五花肉', '玖段招牌厚切五花肉']",2024-06-09 18:54,5.0,"{'口味': '5.0', '环境': '5.0', '服务': '5.0'}"
{'$oid': '6676ca894a1b56542585c488'},食材新鲜，美味烤肉我在这家烤肉店用餐时，对他们的食材非常满意。从肉类到蔬菜，每一样都显得新鲜可口。烤出来的肉质更是口感极佳，鲜嫩多汁，让人回味无穷！南瓜粥的口感让人惊艳，店内服务人员也非常热情周到。这里绝对是一个享受美食的好去处！,[],2024-06-08 22:43,4.5,"{'口味': '4.5', '环境': '4.5', '服务': '4.5'}"
{'$oid': '6676ca894a1b56542585c488'},有人帮忙烤，还有送小饮料，小菜和主食也可以免费加➕不错不错,[],2024-06-08 18:35,3.5,"{'口味': '3.5', '环境': '3.5', '服务': '3.5'}"
{'$oid': '6676ca894a1b56542585c488'},菜量很足，小料小菜无限续很好，服务员态度也很好总之非常推荐,[],2024-06-08 13:08,5.0,"{'口味': '5.0', '环境': '5.0', '服务': '5.0'}"
{'$oid': '6676ca894a1b56542585c488'},环境还不错，排队的人不是很多，适合工作日来吃，非高峰期服务员会帮忙烤肉，体验很好！,[],2024-06-07 17:26,4.5,"{'口味': '4.5', '环境': '4.5', '服务': '4.5'}"
{'$oid': '6676ca894a1b56542585c488'},口味 烤肉味道很不错，有工作人员帮忙烤肉 环境 干净卫生，音乐也非常好听 服务 小姐姐很温柔小哥哥烤肉技术超级好,[],2024-06-07 17:23,5.0,"{'口味': '5.0', '环境': '5.0', '服务': '5.0'}"
{'$oid': '6676ca894a1b56542585c488'},服务态度好，帮忙烤肉。主食免费管饱,[],2024-06-07 13:10,5.0,"{'口味': '5.0', '环境': '5.0', '服务': '5.0'}"
{'$oid': '6676ca894a1b56542585c488'},挺好的，味道不错，服务态度良好，已经第二次来了。,[],2024-06-07 12:56,4.5,"{'口味': '4.5', '环境': '4.5', '服务': '4.5'}"
{'$oid': '6676ca894a1b56542585c488'},价格超级便宜有免费的主食可以选择而且主食打种类也超多 个人比较喜欢那个咖喱猪排和拉面拉面有点微微辣里面还有香肠和鸡蛋完完全全就是韩国那边拉面的味道咖喱猪排饭的话猪排是炸过的咖喱味道很浓很好吃 个人比较喜欢烤肉配白米饭,[],2024-06-07 00:58,4.5,"{'口味': '5.0', '环境': '5.0', '服务': '5.0'}"
{'$oid': '6676ca894a1b56542585c488'},特别好吃，主食免费，非常划算，已经来吃过很多次了，每个月都至少吃一次，最喜欢的是厚切五花肉,[],2024-06-06 18:55,5.0,"{'口味': '5.0', '环境': '5.0', '服务': '5.0'}"
{'$oid': '6676ca894a1b56542585c488'},非常非常非常喜欢！来过好多次啦已经！还会一直支持,['黑猪排骨五花肉'],2024-06-06 18:26,5.0,"{'口味': '5.0', '环境': '5.0', '服务': '5.0'}"
{'$oid': '6676ca894a1b56542585c488'},团购的套餐，没想到品种还蛮多的，还可以帮忙烤，不错。,[],2024-06-06 16:19,4.5,"{'口味': '4.5', '环境': '4.5', '服务': '4.5'}"
{'$oid': '6676ca894a1b56542585c488'},套餐荤素搭配得挺合理的，吃完也不会觉得特别油腻，团购套餐很划算，菜品都很新鲜，无论是肉类还是蔬菜都挺好吃的，他家的炸鸡很好吃，炸的外焦里嫩，强力推荐。服务员也都很热情，会帮忙主动烤肉，就很贴心。店铺环境也OK，体验感不错！,[],2024-06-06 15:54,4.5,"{'口味': '3.5', '环境': '3.5', '服务': '4.5'}"
{'$oid': '6676ca894a1b56542585c488'},位置很好找，服务很不错，菜品很新鲜，套餐价格很便,[],2024-06-06 12:48,5.0,"{'口味': '5.0', '环境': '5.0', '服务': '5.0'}"
{'$oid': '6676ca894a1b56542585c488'},南瓜糊特好喝，主食免费，套餐量大味道也棒，有服务员帮烤，服务态度不错，附近最棒的烤肉店。,[],2024-06-06 12:46,5.0,"{'口味': '5.0', '环境': '5.0', '服务': '5.0'}"
{'$oid': '6676ca894a1b56542585c488'},做完医美去吃服务很好帮烤肉质很一般不太推荐,[],2024-06-05 23:12,4.0,"{'口味': '4.0', '环境': '3.5', '服务': '3.5'}"
{'$oid': '6676ca894a1b56542585c488'},环境不错，菜品新鲜，有特色，味道好，服务也好！,[],2024-06-05 18:08,5.0,"{'口味': '5.0', '环境': '5.0', '服务': '5.0'}"
{'$oid': '6676ca894a1b56542585c488'},第一次来品尝，不错的选择，菜品很丰富，食材很新鲜！,[],2024-06-05 18:08,5.0,"{'口味': '5.0', '环境': '5.0', '服务': '5.0'}"
{'$oid': '6676ca894a1b56542585c488'},南瓜粥好吃，甜甜的，很喜欢。味道很好，下次还会再来的。,[],2024-06-05 17:39,5.0,"{'口味': '4.5', '环境': '4.5', '服务': '4.5'}"
{'$oid': '6676ca894a1b56542585c488'},环境优美，服务特别周到，配套设施特别完善，口味很好，肉质很新鲜，服务员很热情，还会再来的五星推荐，超级棒,[],2024-06-05 17:22,5.0,"{'口味': '5.0', '环境': '5.0', '服务': '5.0'}"
{'$oid': '6676ca894a1b56542585c488'},菜品很多，很丰富，服务也很不错，烤肉好吃，喜欢，上菜速度也很快，南瓜粥好喝，开胃小菜很开胃，好吃爱吃多吃,[],2024-06-04 19:27,5.0,"{'口味': '5.0', '环境': '5.0', '服务': '5.0'}"
{'$oid': '6676ca894a1b56542585c488'},环境好，服务好，味道好，主食可以无限续，不错，下次还来,[],2024-06-04 17:48,5.0,"{'口味': '5.0', '环境': '5.0', '服务': '5.0'}"
{'$oid': '6676ca894a1b56542585c488'},环境很好，就在一楼，服务很好，会帮忙烤肉，干净卫生，下次还来！,"['黑猪排骨五花肉', '玖段招牌厚切五花肉', '雪花猪颈肉', '安格斯横膈膜', '石锅拌饭', '酱料小菜', 'IBP雪花肥牛']",2024-06-04 17:49,4.5,"{'口味': '5.0', '环境': '5.0', '服务': '5.0'}"
{'$oid': '6676ca894a1b56542585c488'},好吃服务好很便宜下次还会来,"['黑猪排骨五花肉', '玖段招牌厚切五花肉', '安格斯横膈膜']",2024-06-04 17:48,5.0,"{'口味': '5.0', '环境': '5.0', '服务': '5.0'}"
{'$oid': '6676ca894a1b56542585c488'},菜品丰富多样，价格合理，物美价廉，味道很好，餐馆服务很好，服务员热情细心，环境很好，干净整洁，氛围感强。,[],2024-06-04 17:26,5.0,"{'口味': '5.0', '环境': '5.0', '服务': '5.0'}"
{'$oid': '6676ca894a1b56542585c488'},超级好吃味道很好，菜品新鲜，服务员态度很好，帮忙烤肉美味！！！！！！！,"['黑猪排骨五花肉', '爆品南瓜粥', '玖段招牌厚切五花肉', '石锅拌饭']",2024-06-03 20:09,4.5,"{'口味': '5.0', '环境': '5.0', '服务': '5.0'}"
{'$oid': '6676ca894a1b56542585c488'},嘻嘻感觉很不错呀肉看着也很新鲜环境也很不错很大看着非常好而且还可以免费续主食哦这让我非常喜欢就算只吃一份但也很开心啦,[],2024-06-03 20:08,5.0,"{'口味': '5.0', '环境': '5.0', '服务': '5.0'}"
{'$oid': '6676ca894a1b56542585c488'},经常过来，口味和服务都不错,[],2024-06-03 18:39,4.5,"{'口味': '5.0', '环境': '4.5', '服务': '5.0'}"
{'$oid': '6676ca894a1b56542585c488'},口味 不错跟朋友一起来吃很好吃分量很足 环境 挺好看的地方不大不小而且很好找就在街道口一楼最里面 服务态度也好帮代烤 很推荐,[],2024-06-03 18:34,5.0,"{'口味': '5.0', '环境': '5.0', '服务': '5.0'}"
{'$oid': '6676ca894a1b56542585c488'},第一次过来，感觉还蛮好吃的，有人帮忙烤，服务态度还蛮好的,[],2024-06-03 18:31,5.0,"{'口味': '5.0', '环境': '5.0', '服务': '5.0'}"
{'$oid': '6676ca894a1b56542585c488'},服务挺好的全程帮忙烤肉 添小料小菜也很及时 但是肉质真的不怎么样吧 烤肉味道一般 主食免费的都好蛮好吃的,[],2024-06-02 21:18,3.5,"{'口味': '3.5', '环境': '4.0', '服务': '4.5'}"
{'$oid': '6676ca894a1b56542585c488'},上菜速度快，主食免费送很划算，学生有七折优惠哦！大学生快来！,[],2024-06-02 19:37,5.0,"{'口味': '5.0', '环境': '5.0', '服务': '5.0'}"
{'$oid': '6676ca894a1b56542585c488'},离地铁站很近味道不错肉很新鲜服务很到位赞,[],2024-06-02 17:55,5.0,"{'口味': '5.0', '环境': '5.0', '服务': '5.0'}"
{'$oid': '6676ca894a1b56542585c488'},[薄荷]环境: 环境好，安静，装修可以。  [服务铃]服务: 服务态度好，小料上的很快 总体来说不错,[],2024-06-02 16:38,5.0,"{'口味': '5.0', '环境': '5.0', '服务': '5.0'}"
{'$oid': '6676ca894a1b56542585c488'},口味 五花肉很推荐烤的外焦里嫩很好吃南瓜粥也很甜爱喝 服务 服务态度也好帮烤就顾着吃就ok了 环境 非常好很干净带孩子来吃 真心非常非常推荐,"['爆品南瓜粥', '玖段招牌厚切五花肉']",2024-06-02 12:24,5.0,"{'口味': '5.0', '环境': '5.0', '服务': '5.0'}"
{'$oid': '6676ca894a1b56542585c488'},进来点菜，只上主食，肉差不多有20分钟后才上，烤盘从来不帮忙换，坐在角落里找服务员真的很难找，基本忙前忙后都不理人，体验感很差,[],2024-06-01 21:59,1.5,"{'口味': '2.5', '环境': '3.5', '服务': '2.5'}"
{'$oid': '6676ca894a1b56542585c488'},味道很不错，服务也不错，跟朋友一起来吃很合适,[],2024-06-01 18:42,5.0,"{'口味': '5.0', '环境': '5.0', '服务': '5.0'}"
{'$oid': '6676ca894a1b56542585c488'},口味：很好吃，吃不了辣下单的时候备注一下就不给放芥末了！超级棒！ 价格：超级便宜，甚至来过好几回！ 服务：服务员性格很好，帮忙烤肉也超级贴心！,[],2024-06-01 17:33,5.0,"{'口味': '5.0', '环境': '5.0', '服务': '5.0'}"
{'$oid': '6676ca894a1b56542585c488'},美味，份量很足，吃的很饱，自己烤的也好吃，还有人帮忙烤，真的很推荐了，来这里的话，环境也很不错，服务也到位，各种小福利,[],2024-06-01 13:18,4.5,"{'口味': '4.5', '环境': '4.5', '服务': '4.5'}"
{'$oid': '6676ca894a1b56542585c488'},这家烤肉店真是美食爱好者的天堂，店内环境整洁舒适，服务周到热情。肉质鲜嫩多汁，烤得恰到好处。 我觉得最关键的是这家店的主食免费，强推辛拉面和南瓜粥，很香的一小份，真的很实惠，但主食里的石锅拌饭我就觉得一般了。 烤肉比较推荐雪花肥牛和牛五花。,[],2024-06-01 12:27,5.0,"{'口味': '5.0', '环境': '5.0', '服务': '5.0'}"
{'$oid': '6676ca894a1b56542585c488'},帮烤服务挺到位，味道也很不错，分量还是挺足，,[],2024-06-01 12:08,5.0,"{'口味': '5.0', '环境': '5.0', '服务': '5.0'}"
{'$oid': '6676ca894a1b56542585c488'},我和闺蜜一起来的，第一次来，店面装修好有氛围感像个小酒吧，墙上贴纸好看，菜品摆盘颜值高讲究，肉肉很多，大大的满足，下次还会来。,"['黑猪排骨五花肉', '玖段招牌厚切五花肉', 'IBP雪花肥牛', '石锅拌饭', '五种烤肉', '泡菜肥牛寿喜锅', '和牛上脑牛排', '和牛三拼', '生菜', '黑猪梅花肉', '和牛上脑', '韩国双味炸鸡', '玖段招牌拌饭']",2024-05-31 20:08,5.0,"{'口味': '5.0', '环境': '5.0', '服务': '5.0'}"
{'$oid': '6676ca894a1b56542585c488'},肉还不错，有人帮忙烤，烤的很不错，尽心尽力。,[],2024-05-31 18:45,5.0,"{'口味': '5.0', '环境': '5.0', '服务': '5.0'}"
