_id,评论内容,喜欢的菜,发布时间,用户总分,用户打分
{'$oid': '665ee6949cd903bf76c03f87'},来过两次这家餐厅吃过两次自助午餐和晚餐都体会过咋说呢环境上没得说是真的不错的服务上感觉除了个别服务员不是很好以外多数服务员都是很好的但是餐品的质量以价目表上价格来说可以吃的品种真的是少之又少这个自助餐餐品的水准感觉也就是在北京120一位的水准可以选太少了活鲜更是只有五样只有蛤类和鲍鱼刺身第一次去只有五种还有北极贝第二次去说北极贝都断货了希望商家可以提升自助餐品的品质,[],"2024-05-01
  更新于2024-05-02 12:34",3.0,"{'口味': '2.5', '环境': '5.0', '服务': '4.5', '品种': '2.5'}"
{'$oid': '665ee6949cd903bf76c03f87'},环境和菜品都很棒，全家老小都很爱来西餐厅，鹿排、新加坡炒蟹、佛跳墙、鹅肝，娃都非常喜欢，水果也很新鲜、种类也多，工工作人员王保伟很细心，发现是娃的生日还特意补了小蛋糕！太感谢啦！,[],2024-05-18 19:24,5.0,"{'口味': '5.0', '环境': '5.0', '服务': '5.0', '品种': '5.0'}"
{'$oid': '665ee6949cd903bf76c03f87'},在这个世界里， 美食如诗，各色风味， 西式烤肉，香气四溢， 东方炒菜，鲜美无比。  新鲜的沙拉，色彩缤纷， 清爽的口感，让人心旷神怡， 热气腾腾的主菜，香气扑鼻， 嫩滑的肉类，入口即化。  甜点的诱惑，让人垂涎三尺， 巧克力蛋糕，甜而不腻， 冰淇淋，清凉解热， 每一口，都是一种享受。  在这个世界里， 自由选择，自由搭配， 满足了每个人的口味， 让人们在品尝美食的同时， 也能感受到自己的独立性和自由。  在这个世界里， 人们可以和朋友或家人一起， 分享彼此的感受和体验， 这种互动，让人们感受到人与人之间的联系和情感。  在这个世界里， 美食如诗，各色风味， 自由选择，自由搭配， 让人们在品尝美食的同时， 也能感受到世界各地的饮食文化。,[],2024-03-10 15:05,5.0,"{'口味': '5.0', '环境': '5.0', '服务': '5.0', '品种': '5.0'}"
{'$oid': '665ee6949cd903bf76c03f87'},真是爽啊自助餐主打的就是一个满足感 尹群花大姐服务的很好经常来倒水清盘 强烈推荐榴莲披萨、炭烤虾、生鲜甜虾、鲜活的生鲜区，鲍鱼花甲、烤蘑菇、蒸虾都很不错。 三文鱼油焖大虾一般般不喜欢自助餐店的火锅和佛跳墙 感觉味道都不咋好,[],2024-05-22 13:09,5.0,"{'口味': '5.0', '环境': '5.0', '服务': '5.0', '品种': '5.0'}"
{'$oid': '665ee6949cd903bf76c03f87'},周五的晚上，两大一小过来吃马纳西的自助 鹅肝还不错，可能是晚上吃饭的人不多，所以厨师👨🏻‍🍳给了超大一块；吃到第三块开始感到腻了 红烧牛肉刀削面也一如既往在线，现做；大块牛肉很过瘾 不足：已经吃了很多次了，菜品一直没有迭代；佛跳墙有点腻 期待多开发新品种,[],2024-04-26 21:46,4.5,"{'口味': '4.5', '环境': '4.5', '服务': '4.5', '品种': '4.5'}"
{'$oid': '665ee6949cd903bf76c03f87'},来过好几次感觉这次午市没什么吃的性价比很不高 基本都是一些冷食，我是奔着以前的榴莲披萨来的没了，我对象奔着牛肉来的也没，基本就一个鹅肝吐司和佛跳墙还行。其他的都一般，菜台那边居然一大堆素菜，最后我基本就在吃基围虾，小龙虾也一般般，总之这次是来这么多次觉得最没啥吃的 作为两百多一个人的自助性价比可以说是非常不高了除了团建组织自己大概率不会再去了，当然环境和服务还是依旧可以的,[],2024-03-24 00:22,3.5,"{'口味': '4.5', '环境': '5.0', '服务': '5.0', '品种': '3.5'}"
{'$oid': '665ee6949cd903bf76c03f87'},今天又相聚一起，不仅吃到美食，而且享受优质服务，特别表扬帅哥（刘畅）服务积极，热心。美女（杨经理）服务贴心周到。特别喜欢吃龙虾，我爸爸特别喜欢吃佛跳墙，侄儿子特别喜欢吃烤羊排，妹妹特别喜欢吃西点蛋糕！,"['烤羊排', '佛跳墙']",2024-05-19 00:01,5.0,"{'口味': '5.0', '环境': '5.0', '服务': '5.0', '品种': '5.0'}"
{'$oid': '665ee6949cd903bf76c03f87'},第一次去虽然远了点，但是环境真心不错哦。 好吃的很多，品类也蛮多，海鲜，羊排，牛排上得都很快，果然是一分钱一分货。 食材蛮新鲜的，蛋挞，提拉米苏味道都蛮好，吃了很多海鲜虾。外面还有小朋友玩的地方，不错哦。 下次带爸妈来感受一下。,"['海鲜', '牛排', '佛跳墙']",2024-05-21 12:25,4.5,"{'口味': '4.5', '环境': '4.5', '服务': '4.5', '品种': '4.5'}"
{'$oid': '665ee6949cd903bf76c03f87'},位置很好找，就在酒店侧边，有停车的地方，停车免费，里面的环境还不错，外面有一个花园，有滑滑梯很适合带小朋友去的，品类不是很多但是够吃，有很多海鲜现点现吃的，佛跳墙是限量的，味道不错，鹅肝也还行，烤羊排好吃！水果品质也不错，服务也不错,"['法式鹅肝', '佛跳墙', '烤羊排']",2024-05-02 19:18,3.5,"{'口味': '3.5', '环境': '4.0', '服务': '4.0', '品种': '3.0'}"
{'$oid': '665ee69c9cd903bf76c03f89'},感觉同价位的自助餐里，金马门是最好的，想吃自助都会优先考虑这里。 首先停车免费，而且从停车场进入电梯非常方便。 用餐建议提前预约，这样人多也不需要排队入场了。 这次去主攻小龙虾，这里有3种口味：蒸虾、蒜蓉、油焖。其中蒜蓉的感觉最好吃。吃了不少。 火锅的方面锅底淡一点，但是可以自己加火锅底料调味，他家的肥牛和毛肚蛮不错的，另外黄喉鱿鱼须也是无限畅吃。 三文鱼味道不错，有油脂香味，特别是鱼腩部分，后面拿的人不多，可以不停的炫。 铁板烧这块需要排队，个人懒得排，耽误时间，不过出餐的品质感觉还可以，运气好捡了牛排的漏，口感可以，是那种比较有嚼劲的牛排，没有参假。 饮料种类非常多，瓶装饮料有元气森林等，用的都是些大牌的水。 整体感觉非常好，下次想吃自助还会来。,[],2024-05-27 15:13,4.5,"{'口味': '4.5', '环境': '4.5', '服务': '4.0', '品种': '5.0'}"
{'$oid': '665ee69c9cd903bf76c03f89'},武汉的一家老牌自助餐厅，想来这家已经很久了，挑了个周末晚上和朋友一起，来得比较晚，已经快八点了，晚上七点半之后是159一位，说实话是冲着小龙虾自助来的，进去的时候小龙虾还有很多，用餐的人也不少  [薄荷]环境：装修简单大方，空间很大很宽敞  [服务铃]服务：店里人员都很好，会有阿姨来收空盘  菜品很丰富多种多样，海鲜铁板泰式日料等等，主要是不限时！,[],2024-05-30 10:40,4.5,"{'口味': '4.5', '环境': '4.5', '服务': '4.5', '品种': '4.5'}"
{'$oid': '665ee69c9cd903bf76c03f89'},每次去金马门都有不一样的体验。如此说这次，服务方面的升级，当你去生鲜区捞了新鲜的鲍鱼后，会有服务人员主动帮你收拾、去壳、清理干净后交还给你，此时你下入火锅中煮熟就可以体验口口都是鲍肉的绝美感觉。尤其是一名叫胡咏霞的服务人员，连着帮我处理了4盘，任劳任怨的精神很值得表扬。这说明金马门也像少数优秀企业那样，在不断完善自己，提升自己。不错，期待下次会有什么不一样的感受。,[],2024-05-30 16:43,5.0,"{'口味': '4.5', '环境': '4.5', '服务': '4.5', '品种': '4.5'}"
{'$oid': '665ee69c9cd903bf76c03f89'},基本上每年都会去几次，今年因为小龙虾上市去了两次，感觉果汁没有以前纯了，甜味很重，不像是纯鲜榨，其他的品质都一如既往的好，第一次去的时候因为带了孩子吃吃玩玩，但是也没超过两个小时，突然火锅的火被撤走了，我说我还没吃完了，服务员说你的已经煮熟了，是熟了没错，但是你拿走了我就不能继续煮了啊，一般自助餐就餐时间都是两个小时，金马门标榜的的是不限时，我两个小时也没到，也没吃完，为什么要撤走，当时带了孩子和同事一起，我也不想扯了，第二次去吃还挺好，没有说提前收,[],2024-05-26 14:52,4.5,"{'口味': '4.5', '环境': '5.0', '服务': '4.5', '品种': '5.0'}"
{'$oid': '665ee69c9cd903bf76c03f89'},那天朋友生日，本来打算去梦时代的亚马逊吃自助餐的，结果那天人超级多，没吃成，后来就在网上搜找了金马门，说实话，这个价位，和现场的菜品，我觉得价格有点偏高了，我们那天去感觉和我们平时吃自助餐没有很大的区别，可能最大的区别就是海鲜类的你选好可以跟你现做，并且我们去，感觉没什么很多种类，当时吃得最多的就是螃蟹，感觉可能刚出来，也没有很多肉，其他的菜品也觉得一般般，对于吃货的我们来说，确实不适合这里要选择性价比更高的位置，不过没来过的还是可以来试试,[],2024-06-02 11:42,2.5,"{'口味': '3.0', '环境': '4.5', '服务': '4.0', '品种': '3.0'}"
{'$oid': '665ee69c9cd903bf76c03f89'},金马门国际美食百汇 武汉市热门榜排名第一名 这一家上个月来吃的时候，感觉口味就非常好。 嗯，这个月来就餐价位比较实在。  主要产品线长，菜品特别丰富。 小火锅加热，多种海产品新鲜鲜活。 中餐烧腊烧烤，十分丰富。  来大学城这边，武汉大学这边就餐这家还是值得品味的推荐给朋友们。,"['三文鱼', '法式红酒鹅肝', '芝士烤生蚝', '甜虾', '芝士焗扇贝', '提拉米苏', '酥皮奶油汤', '生鱼片', '芝士蛋糕', '天妇罗', '刺身', '大蟹腿', '寿司']",2024-05-17 21:59,5.0,"{'口味': '5.0', '环境': '5.0', '服务': '5.0', '品种': '5.0'}"
{'$oid': '665ee69c9cd903bf76c03f89'},难得一家人能一起出去吃个饭，搜索了一下附近的自助餐但凡加了海鲜两个字的，没有一百八九压根你别想吃到 [薄荷]环境: 环境还是可以的，地方比较大，整体装修还蛮清爽，餐位较多，工作日晚上的人都很多，大环境不太好的情况下可见武汉人的消费确实还是可以。 [服务铃]服务: 服务个人觉得基本没服务首先说一下买券这个环节明明大众能团购由于妹妹也不是很清楚有什么优惠方式，收银员完全没提醒顾客团购有优惠，自助品区卫生一塌糊涂，你好歹也189一个人好吗？呈现给顾客就这个场景?其次孩子收费这真的坑，我们家孩子从进去估计吃的东西不到10块钱，尽搞着完去了吃了点水果。  自助菜品: 所谓的海鲜除了点三文鱼就是几种螺，完完全全的没有性价比，就这产品在上海120顶天了，多伦多的产品都比这丰富。 整体没有性价比也就吃这一次了！,[],2024-05-02 19:36,3.0,"{'口味': '3.0', '环境': '3.0', '服务': '2.5', '品种': '0.5'}"
{'$oid': '665ee69c9cd903bf76c03f89'},「法式红酒鹅肝」鹅肝是我来这家店必吃的菜品，入口丝滑「煎小牛排」牛排很嫩，品质不错，每次都吃满满一大盘 在这个价位里，菜品种类超级丰富，可以吃到鲜活的海鲜，鲍鱼，生蚝，基围虾，还有三文鱼等各种刺身，水果种类也很丰富，会根据季节调换，饮料都是大牌，除此之外还有鲜榨果汁，咖啡，奶茶，强烈推荐生打椰汁和火龙果酸奶；各种熟食也是美味又丰富，芝士煽扇贝，芝士煽虾，叉烧肉等等，还有总在排队的鹅肝，牛排和烤虾也是超级好吃；最值得一提的是甜品种类也很丰富，品质也很高，秒杀同价位的其他自助餐，巴斯克泡芙红丝绒蛋糕超级好吃，还有蛋黄酥，焦糖布丁。,[],2024-05-24 10:59,5.0,"{'口味': '5.0', '环境': '5.0', '服务': '5.0', '品种': '5.0'}"
{'$oid': '665ee69c9cd903bf76c03f89'},五一小长假的最后一天，必须出来恰顿好的，11点到的，就已经是人山人海了，壮观，好在排队还挺快，没等多久  [服务铃]服务： 服务员阿姨收盘子很快，小龙虾排队人巨多，但是三个大师傅炒，补货也很快，特种兵[点赞] 「甜虾」「三文鱼」「酥皮奶油汤」「法式红酒鹅肝」「芝士烤生蚝」「佛跳墙」「FABBRI冰淇淋」「水果点心」 159元价位里面，好吃的不得了超级推荐！原本就是奔着小龙虾去的来了发现好吃的真多！ 火锅其实可以不用上，有需要单独点会方便些，也节约成本[狗头],"['三文鱼', '甜虾', '酥皮奶油汤', '清蒸小龙虾']",2024-05-05 13:34,4.5,"{'口味': '4.5', '环境': '4.5', '服务': '4.5', '品种': '4.5'}"
{'$oid': '665ee69c9cd903bf76c03f89'},#夏日寻虾季#超值自助餐 五一期间和闺蜜约着聚一聚 选择这家金马门自助之前就听朋友说这家店很不错 一直考虑去尝下这次真惊艳到我让我知道吃自助海鲜火锅可以这么棒的体验，我们先很早去拿的号在旁边商场玩了一圈号就到我们了，人是真多，毕竟五一假期时间 虽然五一期间很多人，但是服务还是真的好，服务员很及时一直在服务我们，很热情 他们家的虾真的是什么口味都有。但是人很多，要排队。 麻辣小龙虾很好吃，还有蒸虾，还有蒜蓉虾。品种真的很多。虾的味道也不错，也很新鲜，鸳鸯锅也还不错。辣锅挺辣的。三文鱼也很好吃。还有很多海鲜是活的，三文鱼可以随便拿，不会限制你什么。他们家品质还是挺好的。熟食啥的什么都有，想吃自助下次还是会去他们家吃自助。#吃货的世界唯有美食不可辜负真不错#自助餐#自助餐推荐,[],2024-05-13 17:27,4.5,"{'口味': '5.0', '环境': '4.5', '服务': '5.0', '品种': '5.0'}"
{'$oid': '665ee69c9cd903bf76c03f89'},武汉的老牌自助了，必须给大家强烈安利！从校园吃到结婚生子，吃了这么多家自助餐厅，金马门真是性价比之王！ 📍位置：这家餐厅的位置很好找，交通也非常方便，就在珞喻路君宜王朝大酒店5楼。如果开车过来要注意进入辅路后一定要走最右车道，不然开过就进不了停车场了！吃完记得在前台取停车票🅿️ 环境：餐厅的环境非常干净整洁，让人感觉很舒适。装修风格简约时尚，很有氛围感，也有儿童游乐区，适合遛娃。面积比较大，可惜户外没什么风景，就是大马路。 👩‍🍳服务：服务员态度热情周到，点菜上菜速度都很快，还会主动帮忙换餐盘，让人感觉很贴心。人多可以提前预约包厢，私密性更好～ 🥘菜品：这里的菜品真的非常丰富，各种海鲜、肉类、蔬菜、水果、甜点应有尽有，而且都很新鲜。现在又到小龙虾季，外面已经吃不起了，但金马门不限量供应，一人一盘吃回本！重点推荐他们家的鹅肝、牛排、鲍鱼和黑虎虾，慕斯和芝士也都超赞！ 💰价格：价格也非常实惠，而且一米二以下的儿童还免费哦！充值会员的话，每位还可以送一道份例菜，三选一哦，强烈推荐他们家的深海虾球，味道鲜美，口感嫩滑。  「法式红酒鹅肝」「煎小牛排」「鲜活扇贝」,"['法式红酒鹅肝', '芝士蛋糕', '寿司', '甜虾']","2024-04-17
  更新于2024-04-18 09:46",5.0,"{'口味': '5.0', '环境': '5.0', '服务': '5.0', '品种': '5.0'}"
{'$oid': '665ee69c9cd903bf76c03f89'},朋友说去吃自助餐，蹭了餐饭，不得不说品种还是很丰富的，海鲜刺身烧烤火锅都有，菜品上的还是很快的，即便空盘了，过一会儿又会补充不会等很久，小龙虾管够，油焖清蒸蒜蓉随便吃，虾都很新鲜肉质紧实味道也不错。鹅肝，好吃，浇上酱汁解腻，战斗力有限，火锅没尝试。饮料有很多品种的果汁，原汁原味，糕点稍微甜了一些，服务员姐姐清理残渣很主动，看见桌子上堆着了就主动来帮忙清理，冰激凌味道很正，吃撑了又干掉两个冰激凌球，价位稍微高了一点点，要是有活动就更完美了,[],2024-04-27 11:48,4.5,"{'口味': '4.5', '环境': '4.5', '服务': '4.5', '品种': '4.5'}"
{'$oid': '665ee69c9cd903bf76c03f89'},⚠️生日福利⚠️ 生日当天凭借证件立减50 或者四人同行一人免费  人气爆品畅吃无压力 三文鱼🍣生蚝🦪小龙虾🦞  酒水饮品果汁🍹生鲜水果🥭 火锅烤物🍖蛋糕烘培甜点🍰 熟食凉拌各国各地的美食  日本🇯🇵寿司泰国🇹🇭冬阴功马德里🇪🇸烤肠 意大利🇮🇹手工冰淇淋胡志明🇻🇳豆腐花 🇨🇳北京烤鸭老北京酸奶武汉热干面广式蒸笼 台湾卤肉饭…品种太多了，看得眼花缭乱～  门店前装修后多了包厢，有大包厢（四张桌子）和小包厢（两张桌子），更有意思的是，这些包厢都以武汉的著名景点命名，比如黄鹤楼、晴川阁、古琴台、紫阳湖、汤逊湖等。  除此还多了一个儿童游玩的区域，滑滑梯、小型旋转木马，孩子玩得很开心，低龄小朋友也可以安全玩耍。,['三文鱼'],2024-05-11 13:28,4.5,"{'口味': '4.5', '环境': '4.5', '服务': '4.5', '品种': '5.0'}"
{'$oid': '665ee69c9cd903bf76c03f89'},说金马门是武汉火了最久的一家自助应该不过分吧  [薄荷]环境: 第一次去金马门大概是十年前了，虽然装修最近几年有点变化，但总体格局一直如一，因为是酒店自己的楼，用餐场地真的很大，虽然场子里人很多，但也不会拥挤，桌椅走道都算宽敞  [服务铃]服务: 虽然吃饭的人超级多，但收拾餐盘还是蛮及时的，这个体量来水服务算很不错了 「基围虾」大概每次来金马门最大乐趣之一就是捞虾子现捞的虾子超级鲜活，得小心从盘子里或者锅里蹦的满地都是，新鲜的很直接 「奶油酥皮汤」「法式红酒鹅肝」「法国焗蜗牛」自助经典三件套，过去这几张似乎还是限量，现在貌似也是随意拿，奶油酥皮汤是好吃的，但建议多人分着吃，太顶饱了 「三文鱼」人多的时候需要排队，个人对三文鱼没太大兴趣不评价 「芝士烤生蚝」「芝士焗扇贝」芝士系列，酱很足，好吃但吃多了容易腻哦 「螃蟹」秋季特供！推荐炸肉蟹，肉蟹劈两半炸制，几口一个真的吃到爽 「油焖小龙虾」夏季特供！等虾子肥的是时候去吃，不限量，就是取的时候需要排一下队，直接小龙虾自由 「烤羊排」冬天的时候似乎也有烤全羊主题，不太爱羊肉没去尝试 它家季节性的会推出相应主题，供应些非日常的餐品，可以看看官微的推送，等有感兴趣的主题再来吃,[],2024-04-07 16:35,4.5,"{'口味': '4.0', '环境': '4.5', '服务': '4.0', '品种': '5.0'}"
{'$oid': '665ee69c9cd903bf76c03f89'},终于打卡了期待很久的金马门 [薄荷]环境: 首先非常非常大，一进门是甜品冰淇淋区，然后有泰餐区、刺身寿司区，铁板区，烧腊，水果，小炒，火锅等等等等，我们做的靠里，拿个冰淇淋来回都能走五分钟 [服务铃]服务: 服务来说，收盘还算及时，海鲜区去了好几次都没人，不知道找谁处理活虾 「法式红酒鹅肝」这个一次限量两块，配上蓝莓酱很好吃，吃多了会觉得腻 「提拉米苏」甜品味道不 「清蒸小龙虾」小龙虾现在品质都不错，黄多q弹，没吃到粉的 虾类吃了很多，黑虎虾肉质最q弹，鲍鱼个头还行，烤生蚝个头偏小。 总体来说，种类很多，海鲜的话因为我吃不惯刺身吃的虾很多，品质都还行，鲜活的基围虾因为没看见人，没人帮忙处理就没有吃。小龙虾可以猛猛吃,[],"2024-05-30
  更新于2024-06-02 00:30",4.0,"{'口味': '3.5', '环境': '4.5', '服务': '3.5', '品种': '5.0'}"
{'$oid': '665ee6a09cd903bf76c03f8b'},来自孩子的100分好评！玩过这么多酒店最开心的一次，一个完美的六一！ 酒店环境优美，服务效率高，给人很舒服的感觉，酒店项目很丰富，菜色就不用说了，已经不是第一次来了！中午的烧烤是孩子烤的，味道那叫就一个绝了，菜品质量也很高！ 晚上的湖边自助也是必须要好好夸奖的！吹着湖风搭配上现场演唱的歌声，瞬间忘记一切烦恼，孩子也玩的很尽兴！总之，是一次不错的体验！还会再来！,[],2024-06-01 19:32,5.0,"{'口味': '5.0', '环境': '5.0', '服务': '5.0', '品种': '5.0'}"
{'$oid': '665ee6a09cd903bf76c03f8b'},位置：较远在光谷东北角 环境：环境优雅宽敞不过桌子略小了点多放几个盘子就放不下了 服务：服务没得说有求必应 菜品：菜品种类还是比较多的小龙虾基围虾罗氏虾黑虎虾个头非常大接近一个手掌大小三文鱼刺身很不错个人比较喜欢另外有现炒现蒸的海鲜热菜也比较多中式西式日式的热菜都有还有烤串和冷串等 问题：位上的金枪鱼还行战斧牛排不太行柴到难以咀嚼还不如不限量的牛肋条羊腿等等按理说不应该这么柴建议位上菜认真打磨一下可以成本低一点但是品质、创意得到位毕竟要对得起价格,[],2024-05-26 19:30,5.0,"{'口味': '4.5', '环境': '5.0', '服务': '5.0', '品种': '4.5'}"
{'$oid': '665ee6a09cd903bf76c03f8b'},你好呀👋热干面🍜 接受阿姨🧍‍♀️美好祝福的一天 有钱把日子过好 没钱把心情过好 时间扑面而来 我们终将释怀  [薄荷]环境：餐厅面积挺大的，有部分区域可以看到室外园景，看起来还是很舒服惬意的用餐氛围。 [服务铃]服务：下面条的阿姨很nice，知道我在拍她，笑嘻嘻的，端上来的这碗热干面，充满了阿姨的美好祝福，真的太美味😋。 ✔️早餐还有海鲜粥可以喝，真不错,['热干面'],2024-05-25 12:02,5.0,"{'口味': '5.0', '环境': '4.5', '服务': '5.0', '品种': '5.0'}"
{'$oid': '665ee6a09cd903bf76c03f8b'},早餐品种丰富。来开会，很忙碌，无法出去品尝当地特色，酒店早餐提供了很好的选择。米酒醪糟、糯米包油条，特别是热干面，都很好吃 煮面的陈大姐服务态度很好，调的面条口感也很好，几个同事都很喜欢吃。服务态度和蔼可亲，煮面时候拉拉家常，让人有温馨的感觉，一看就是热爱生活的人手动点赞,[],2024-05-23 06:57,5.0,"{'口味': '5.0', '环境': '5.0', '服务': '5.0', '品种': '5.0'}"
{'$oid': '665ee6a09cd903bf76c03f8b'},五一的第一天来到了希尔顿酒店啦🏨  [薄荷]环境： 酒店满眼的绿色，空气新鲜，坐落在严西湖边心旷神怡 带小朋友一起来，遛娃圣地 五一还有打铁花非遗表演  [服务铃]服务： 晚上吃了自助餐厅，品类丰富，都是大餐 小朋友也有很多可以吃的 小姐姐们服务很好，会引导小朋友注意安全  抓鱼摸虾是小朋友的快乐天堂,[],2024-05-02 10:49,4.5,"{'口味': '4.5', '环境': '4.5', '服务': '4.5', '品种': '4.5'}"
{'$oid': '665ee6a09cd903bf76c03f8b'},菜品很多，7个餐台可以选择，无论是中式菜还是西式菜都可圈可点，三文鱼海鲜不限量随你夹，现扒的牛排，现炒的小海鲜还有歌手驻唱，服务人员态度很好，收餐也及时，厨师还会把炒好的菜给你拿过来，值得常来的宝藏打卡地,"['冰淇淋', '羊排', '牛排', '现烤蒜蓉生蚝']",2024-05-17 18:20,5.0,"{'口味': '5.0', '环境': '5.0', '服务': '5.0', '品种': '5.0'}"
{'$oid': '665ee6a09cd903bf76c03f8b'},[薄荷]环境： 出差我常住这家武汉光谷希尔顿酒店，酒店在花山，挨着碧桂园，背靠严西湖，环境挺好，就是有点偏，出入都得打车。  早餐就在这家创味全日自助餐厅，餐厅面积很大，我觉得能有一千平。品类很丰富，面档有热干面、牛肉粉面等，我一般轮流吃。煎蛋、各种肠、面包、蔬菜都有。 这次去发现新增了单蒸的蒸蛋，和单碗的生滚粥，少了豆腐脑。 整体而言品种丰富，可以满足你的各种诉求。,[],"2024-02-25
  更新于2024-02-26 11:24",4.0,"{'口味': '4.0', '环境': '4.0', '服务': '4.0', '品种': '4.5'}"
{'$oid': '665ee6a09cd903bf76c03f8b'},558在**上买的两大一小套餐首先是锅底，三选一（辣汤底、番茄🍅汤底、寿喜锅汤底）还不如海底捞的锅底，只能选一个锅！一点都不划算 这个冻虾🦐一点都不新鲜本来还以为是北极甜虾，结果每一只里面都是黑线（如图）说明虾的生活费环境不好吃起来也很不新鲜而且闻起来有一阵放了几天的那种味道 生蚝🦪也很老一点也不新鲜也不嫩不q弹很难吃 鲍鱼也是在那吃的所有海鲜都不是很新鲜 这个价格500多一点也不划算，感觉根本没吃到什么东西，踩雷品种也不是很多品质太差了完全不值这个价格！还不如市内的其他品牌自助餐，比这个划算品种还多！,[],2024-03-23 22:10,,"{'口味': '0.5', '环境': '0.5', '服务': '0.5', '品种': '0.5'}"
